id,titre,prix,surface_m2,nb_chambres,nb_salons,nb_sdb,quartier,description,caracteristiques,source,date_publication
1076,منزل احذ اللنكات حمام الياسمين ,1800000.0,150.0,3.0,2.0,,Arafat,دار للبيع اعل شارع اكبير احذ حمام الياسمين اللنكات اثلت ابيوت و جلسه و كوزين و دشات ,Titre foncier | 1 balcon(s) | Taille rue: 15.00 | Proche de: حمام الياسمين | Garage,voursa.com,2025-09-13
875,فرصة دار مكونه من طابقين ارضي و واحد فوقوني كارفور توري,1800000.0,300.0,6.0,3.0,,Tevragh Zeina,فرصة دار ، الطابق الأرضي يحتاج ترميم بسبب الملح و الطابق الي فوقه صالح للسكن مباشرة، يتكون من أربع غرف و حمامين و مطبخ، كارو كامل، في الركن، بضعة أمتار من كارفور توري فرصه حقيقية,1 balcon(s) | Taille rue: N/A | Proche de: كرفور توري | Garage,voursa.com,2025-07-06
453,دار فتيارت فاتح فبرك,900000.0,216.0,1.0,1.0,,Teyarett,"سعر 9ملايين مدخله 50الف حد شاري ول عندو طلب تلفنل اعل واتساب فقط
26678975",Titre foncier | type de propriété: Autre | 1 balcon(s) | Taille rue: 15.00 | Proche de: بقاله الرحمه,voursa.com,2026-01-20
987,دار للبيـــــــــــــــــــــع أفي عين الطلح,1600000.0,150.0,3.0,1.0,2.0,Teyarett,السلام عليكم ذاك دار للبيـــــــــــــــــــــع أفي عين الطلح مساحتو 150 فاتح اعل شارع إصغير مبيوعه ب 16 مليون حد مهتم يتواصل معاي [TÉLÉPHONE SUPPRIMÉ],,voursa.com,2025-12-09
252,ملح سكتير 2,800000.0,180.0,3.0,2.0,,Toujounine,"السلام عليكم 
فرصة للبيـــــــــــــــــــــع ملح سكتير 2
فاتح على شارع 25 وفكرن شارع 25
فيها ثلاث باتيك 
من داخل فيها ثلاث بيوت دوشات كوزين فرندا 
",Titre foncier | 1 balcon(s) | Taille rue: 25.00 | Proche de: ملح سكتيراثنين,voursa.com,2025-04-18
381,منزل أرضي يتكون من طابقين للبيع,5000000.0,516.0,9.0,3.0,4.0,Teyarett,منزل في عين الطلح  يتكون من طابقين فاتح اعل كدرونه وفكرن صالح  للإستثمار,Garage,voursa.com,2026-02-05
1251,دار للبيـــــــــــــــــــــع أفي  سو كجيم عين الطلح ,2300000.0,180.0,3.0,2.0,,Teyarett,"دار للبيع في سوكجيم عين الطلح 
مساحتها 180 على شارعين اكبار 
ب 23 مليون ابريمير اشوا حد مهتم يتواصل معاي واتساب 27273277حد العقار اللبيع يتواصل معاي ",1 balcon(s) | Taille rue: 15.00 | Proche de: دار للبيـــــــــــــــــــــع أفي سوكجيم ,voursa.com,2025-09-24
84,منزل للبيع ,6500000.0,600.0,4.0,2.0,,Tevragh Zeina,"#للبيع❤ 

فرصة لا تعوّض!

منزل للبيع بمساحة 600 متر مربع، في موقع مميز قرب مسجد الشيخ الرضى.
الوثائق تيتر فونصي جاهزة، 
#السعر 
 بـ 65 مليون فقط!



للتواصل والاستفسار: [ ‏ عبر واتساب. https://wa.me/22243414552
",2 balcon(s) | Taille rue: 20.00 | Proche de: مسجد الشيخ رضى ,voursa.com,2025-04-24
193,شانتيه ,1200000.0,200.0,1.0,1.0,,Arafat,"السلام عليكم 
الموقع استراتيجي واستثماري 
نيمرو للبيـــــــــــــــــــــع كد مفوضية شرم الشيخ 
فاتح على كدروه وفكرن 
فيه ابوتيك 
صالون دوش كوزين لاحكين صناج فينال 
ثاني ماركه فندصيوه 
السعر 12 مليون ",type de propriété: Autre | 1 balcon(s) | Taille rue: 40.00 | Proche de: مفوضية شرم شيخ ,voursa.com,2026-01-28
175,دار فسيت ابلاج bmciفاتح فبرك وفكرن,3800000.0,400.0,7.0,1.0,2.0,Sebkha,سعر 38 مليون حد شاري تلفنل اعل واتساب وتوف [TÉLÉPHONE SUPPRIMÉ],,voursa.com,2026-02-16
44,منزل للبيـــــــــــــــــــــع عرفات ,1300000.0,150.0,3.0,2.0,,Arafat,"السلام عليكم 
دار مظبوطة للبيــــــــــــــــــــع   عرفات كد مركز تكوين العلماء
فاتح على بركين
 بينه مع كدروه ثلاث نمروات 
فيه ثلاث بيوت وجلسة كوزين ودوشات اكراج منقوشة مكروية
 المساحة150م٢ 
السعر 13مليون",Titre foncier | 1 balcon(s) | Taille rue: 15.00 | Proche de: مركز تكوين العلماء  | Garage,voursa.com,2025-08-31
791,سمعه فملح سكتير 5,980000.0,150.0,5.0,2.0,,Toujounine,سمعه فرصة  فملح سكتير 5 اكريب من شارع ديمي  اكريب من ذاك استاسيوه ال اعل ايدكم العربية,Titre foncier | 1 balcon(s) | Taille rue: 8.00 | Proche de: شارع ديمي  | Garage,voursa.com,2025-09-22
655,الفوج,2100000.0,180.0,9.0,4.0,,Arafat,أبرمتماه عل كدروه فيه من تحت دار من الفوق أستيديوهن مستقلين ومن تحت مكزين مدخل 200ألف,1 balcon(s) | Taille rue: 40.00 | Proche de: دسق,voursa.com,2025-09-21
65,دار فسوكوجيم عين الطلح,2200000.0,150.0,3.0,1.0,2.0,Teyarett,دار اجديده فسوكوجيم عين الطلح,Garage,voursa.com,2026-02-24
834,فرصة 4 آبرتمهات للبيـــــــــع ف H8 إحذ المدرسه ,4600000.0,216.0,8.0,8.0,,Teyarett,4 آبرتمهات ف H8 إحذ المدرسه مساحتهم 216م٢ إعلى شارع 10 مدخلين 400الف ب 46 ,2 balcon(s) | Taille rue: 10.00 | Proche de: المدرسه الجمهورية  | Garage,voursa.com,2025-07-14
877,فرصة نادرة ديبلكس فاخر فمنطقة snde ,5900000.0,250.0,8.0,5.0,,Tevragh Zeina,"🔴🔴فرصة عقارية نادرة دوبلكس قرب snde 
على مساحة 250m2 
علي شارع واسع وحي راقي 
😍😍المواصفات :
صالون  كبير وجلسة وبيت ودوش التحت ولكدام كوزينين واحد داخلي وواحد خارجي و بيت عامل ودوش وكراج اوتوماتيك يرفد سيارتين
والفوك فيھا 4 بيوت ركاد و3 دوشات داخليين طبعا بيت 
الركاد الرئيسي اكبر حت من لخرين
 السعر  59 مليون ",Titre foncier | 1 balcon(s) | Taille rue: 20.00 | Proche de: SND | Garage,voursa.com,2025-09-15
1428,ديبلكس اجديد  للبيــــــــــــــــــــــع,5000000.0,150.0,6.0,1.0,2.0,Teyarett,*ديبلكس اجديد  للبيــــــــــــــــــــــع في البوادي قرب شقق الصحاري  فاتح عل شارع اكبير مساحة  150 م² مبيوع 50 مليو,,voursa.com,2025-06-06
347,منزل نظيفة للبيع ملح سكتير 2,1500000.0,180.0,3.0,2.0,,Toujounine,"السلام عليكم 
دار نظيفة للبيـــــــــــــــــــــع 
فملح سكتير 2
 كريب من كدروه فاتح على رامبلة 
فيها ثلاث بيوت وجلسة كوزين ودوشات اكراج منقوشة مكروية 
المساحة 180
السعر 15 مليون ",Titre foncier | 1 balcon(s) | Taille rue: 40.00 | Proche de: ملح سكتير 2,voursa.com,2025-05-09
244,فرصة عمار للبيع  ,1000000.0,244.0,,10.0,,Tevragh Zeina,"فرصة  عماره للبيع المقر  كابيتال  قرب مسيد شرفاء
فيه 10برتماهة
و7مكزينات مدخل1مليون و200الف شهري 
مساحة244m² سعر 100مليون ",Titre foncier | 10 balcon(s) | Taille rue: 20.00 | Proche de: عمار كابيتال للبيع ,voursa.com,2025-10-03
580,استوديو إف نص نيمرو للبيع,1200000.0,108.0,1.0,1.0,,Teyarett,استوديو إف نص نيمرو للبيع اعل شارع 20 افحي سكني زين فيه بيت اركاد وجلسه ودوش وكزين فيه مكزين فاتح اعل شارع اكبير ايكد  حد بكريه ب 40 وهو مكري ظرك ب 65 ويكد يبني حد فوكو ,Titre foncier | type de propriété: Studio | Taille rue: 20.00 | Proche de: كدرونه سكوكو | Caméra de sécurité,voursa.com,2025-12-07
990,منزل للبيــــع بالقرب من شارع البوليس,700000.0,150.0,3.0,1.0,2.0,Arafat,"دار للبيــــع فكرفور بالقرب من شارع البوليس 
المساحة 150م٢ 
الشارع 10م
الثمن 7 مليون",,voursa.com,2025-12-09
730,دار فملح,530000.0,150.0,1.0,4.0,1.0,Arafat,"سلام عليكم 
عندنا ذيك دار للبيع اف ملح سكتير 3
فاتح اعل بارك 
فيه ثلاث ابيوت أو جلسة أو مرافق 
خاصها النقش أو كرو 
السعر 5 مليون و 300 قابلة للنقاش تلفنل اعل واتساب فقط [TÉLÉPHONE SUPPRIMÉ]",,voursa.com,2026-01-01
1213,شانتيه فملح سكتير 1,600000.0,144.0,3.0,1.0,2.0,Toujounine,شانتية فملح سكتير 1,Garage,voursa.com,2025-11-10
567,منزل جديدة للبيع المطار القديم ,3000000.0,200.0,4.0,2.0,,Dar Naim,"السلام عليكم 
دار جديدة في المطار القديم 
فاتح على شارع 12
فيه صالون بيت اركاد بتين جلسة كوزين ودوشات اكراج مكروية منقوشة مكروية 
المساحة200م٢ 
السعر 30مليون",Titre foncier | 1 balcon(s) | Taille rue: 12.00 | Proche de: أستاسيون زيتي | Garage,voursa.com,2025-06-17
424,ابرتماهين وبتيك ف الجامعه لاول لللبع ,4800000.0,200.0,1.0,1.0,,Tevragh Zeina,اللسلام عليكم هذ ابرتماهين وبتيك ملني ف 200م# مدخلين اثلت مائة واخمس تلاف قديمة. مبيوعين ب 48مليون للإستفسار اكثر.اتصلوا على الرقم التالي 49546950,1 balcon(s) | Taille rue: 20.00 | Proche de: ألجامعه لاول ,voursa.com,2025-04-30
1160,عند جسر مدريد,1250000.0,150.0,3.0,2.0,,Arafat,"دار بدخله ومبيوع  واتساب 26678975
للاتصال 36147216",1 balcon(s) | Taille rue: 8.00 | Proche de: كرفور مدريد,voursa.com,2025-03-30
630,دوبلكس  طراز اول حذي اتاك الخير 1,1500000.0,400.0,6.0,4.0,,Tevragh Zeina,"دوبلكس طراز. اول عصري وراقي حذي اتاك الخير 1
فاتح علي شارع كبير 
المساحة:400م
للمزيد من التفاصيل والمعاينه دوبلكس 
التواصل:38713233
الواتساب: 38713233",3 balcon(s) | Taille rue: 25.00 | Proche de: دوبلكس قرب اتاك الخير 1,voursa.com,2025-05-19
519,جبلكس للبيع في  تفرغ زينه شرم الشيخ قرب البوادي,5500000.0,250.0,8.0,3.0,5.0,Tevragh Zeina,هاذي السمع زينه واجديد مافاة اند اخلة فيه فرصة اليوم,Caméra de sécurité | Meublé | Garage,voursa.com,2026-01-24
37,منزل,1300000.0,180.0,6.0,1.0,3.0,Arafat,منزل في كارفور الدخل 200الف يباع ب13مليون,,voursa.com,2026-02-25
733,سمعه  االقوك وتحت ف تن سويلم بالقرب من البوصط للبيع,1300000.0,150.0,1.0,1.0,1.0,Dar Naim,السلام عليكم هذ سمعه ف تن سويلم بأقرب من البوصطه مساحتها 150م# الفوك مستقل عن التحت مدخلي 120الف شهريا مبيوع ب 13مليون للإستفسار اكثر اتصلوا على الرقم التالي [TÉLÉPHONE SUPPRIMÉ],,voursa.com,2026-01-03
1058,منزل جديدة للبيــــــــــــــــــــــع فلفلوجة,22000000.0,180.0,3.0,1.0,2.0,Arafat,"السلام عليكم 
دار جديدة مافات اندخلت
  الفلوجة سوق الياقوت
 فاتح على شارع كبير فكرن كريب من كدروه
 المساحه 180م٢
 فيه صالوه ثلاث بيوت جلسه فراند  كراج كوزين  دوشات 
السعر 22 مليون",Garage,voursa.com,2025-12-02
405,4 برتمهات  للبيع,5000000.0,180.0,6.0,4.0,,Teyarett,4 ابرتمهات للبيـــــــــــــــــــــع في سوكوجيم عين الطلح مساحة 180م٢  فاتح على شارع كبير مدخلين 400 ألف مبيوع ب 50 مليون قابلة للتفاوض حد مهتم يتواصل معاي واتساب ,1 balcon(s) | Taille rue: 18.00 | Proche de: عين طلح ,voursa.com,2025-06-24
262,فرصة 300 متر ف اف نور قرب دار زين العابدين,3400000.0,300.0,0.0,0.0,0.0,Tevragh Zeina,فرصة 300 متر مربع قرب دار زين العابدين بين البنيان,,voursa.com,2026-02-10
612,دار فملح من كد الفلوجة,1300000.0,180.0,3.0,1.0,,Arafat,دار حقيقية فملح سكتير 2 احذ الحماية المدنية,Titre foncier | type de propriété: Villa | 1 balcon(s) | Taille rue: 20.00 | Proche de: الفلوجة | Garage,voursa.com,2025-12-18
1376,ديبلكس طراز أول فسكتير 5 صحراوي مساحة 375م٢,9500000.0,375.0,6.0,5.0,,Tevragh Zeina,ديبلكس طراز أول فسكتير 5 صحراوي مساحة 375م٢ مبيوع ب 95 مليون,Titre foncier | 1 balcon(s) | Taille rue: 20.00 | Proche de: سكتير 5 | Garage,voursa.com,2025-08-31
155,ابرتماهين للبيـــــــــــــــــــــع عرفات الداية 17,800000.0,120.0,4.0,1.0,,Arafat,"السلام عليكم 
فرصة اليوم 
ابرتماهين ارضينه
فاتحين على شارع 6
كلهم فيه بيتين فرندا دوش كوزين 
للبيـــــــــــــــــــــع عرفات الداية 17 كد مدرسة ذوالنورين 
الداخل الشهري 65الف
السعر 8 مليون 
",Titre foncier | 1 balcon(s) | Taille rue: 6.00 | Proche de: قرب مدرسة ذوالنورين ,voursa.com,2025-05-17
608,في سكتير 4 أفه نوره,7500000.0,200.0,6.0,1.0,3.0,Tevragh Zeina,ديبلكس نظيف مبني بناء حديث وراقيه وديكور رائعه جذاب  ولم يسكنها احد بعد,Garage,voursa.com,2026-01-16
82,منزل للبيع ,13500000.0,600.0,12.0,3.0,,Tevragh Zeina,سمعة مساحتها 600 فاتح أعل كرن قرب مسجد ولد الددو,Titre foncier | 4 balcon(s) | Taille rue: 1.00 | Proche de: مسجد ولد الددو | Garage | Caméra de sécurité,voursa.com,2025-08-11
1385,4نمروات معاهم دار فالمشروع ,3000000.0,216.0,4.0,1.0,,Teyarett,"تلفنلل اعل واتساب 26678975 دخله 300زايد
سعر 30مليون مساحه 216*4",1 balcon(s) | Taille rue: 25.00 | Proche de: فور ول سبرو,voursa.com,2025-06-27
1043,ديبلكس فظهر اللؤلؤ,2800000.0,120.0,7.0,2.0,,Teyarett,سعر 28 مليون حد ايدور عقار ول خدمه تلفنل 26678975.36147216,Titre foncier | 1 balcon(s) | Taille rue: 15.00 | Proche de: مجمع اللؤلؤ ,voursa.com,2025-10-31
486,سمعه اجديد فتوجنين,1100000.0,120.0,7.0,2.0,,Toujounine,سعر 11 مليون حد شاري تلفنل 26678975.36147216,Titre foncier | 1 balcon(s) | Taille rue: 18.00 | Proche de: توجنين,voursa.com,2025-09-20
792,دار أرضيه.,6500000.0,300.0,4.0,1.0,3.0,Tevragh Zeina,فيلا أرضيه. جديد المنطقة سكتير 5 تفرق زينه. مساحته 300 م.,Garage,voursa.com,2025-12-27
739,كرفور ادرار شارع 10,350000.0,180.0,4.0,2.0,,Toujounine,اتصل واتساب 26678975 السعر 350000,1 balcon(s) | Taille rue: 10.00 | Proche de: كرفور ادرار ,voursa.com,2025-05-29
1261,دار زينة فلكصر بين بقالة الصين وطب صنادرة,1600000.0,216.0,4.0,2.0,,Ksar,"شارع ماه سقير وكريب من كدروه 
ملاحظة للراغبين في شراء أو بيع دار او نيمرو ماعليكم سوى التواصل معنا والله المستعان",1 balcon(s) | Taille rue: N/A | Proche de: بقالة الصين,voursa.com,2025-10-05
998,دار فعين الطلح احذ 28نوفمبر,4000000.0,180.0,5.0,1.0,3.0,Teyarett,دار اعل كدروه احذ 28 نوفمبر,Garage,voursa.com,2025-12-08
1402,اجديده احذ كدروه شباب,3500000.0,216.0,5.0,2.0,,Teyarett,"السعر 35مليون قابل للنقاش واتساب 26678975
للاتصال 36147216 مساحه 216",1 balcon(s) | Taille rue: 30.00 | Proche de: كدروه شباب,voursa.com,2025-06-03
417,دار نظيفة كرفور امحيرث ,900000.0,150.0,3.0,2.0,,Toujounine,دار حقيقية فكرفور امحيرث الفوك فيه بيت و دوش و امبار,Titre foncier | 1 balcon(s) | Taille rue: 10.00 | Proche de: كرفور امحيرث  | Garage,voursa.com,2025-09-23
635,ديبلكس للبيع ,8500000.0,250.0,5.0,3.0,,Tevragh Zeina,"ديبلكس للبيع في منطقة سكتير5 تفرغ زينه 
للاستفسار 49719051",2 balcon(s) | Taille rue: 20.00 | Proche de: ديبلكس للبيع  | Garage,voursa.com,2025-03-31
275,دبلكس للبيع في سكتير 4اجديد ,7500000.0,200.0,6.0,3.0,,Tevragh Zeina,دبلكس ماكط اندخل اجديد ,Titre foncier | 3 balcon(s) | Taille rue: 15.00 | Proche de: سكتير 4 | Garage,voursa.com,2025-07-05
654,ابرتمهات جدد فسكتير 5 شارع 8,4500000.0,180.0,7.0,2.0,,Tevragh Zeina,"حد دورهم تلفنل اعل واتساب 26678975 . للاتصال 
36147216 سعر 45مليون",Titre foncier | 2 balcon(s) | Taille rue: 8.00 | Proche de: تراب هيداله,voursa.com,2025-07-30
1138,ابرتماهات في اغنودرت للبيع,2400000.0,300.0,3.0,2.0,,Tevragh Zeina,ابارتماهات 2 المساحة 300م ,Titre foncier | 1 balcon(s) | Taille rue: 12.00 | Proche de: Station agnodert,voursa.com,2025-07-13
1262,دوبلكس فسانتير متير,53000000.0,180.0,5.0,3.0,,Tevragh Zeina,"دوبلكس فسانتير متير اتراب ديدي جديد ماكط اندخل ماهو واعر  مبيوع فرصة 
المساحة: 180م
السعر :54مليون قابلة للنقاش
حد كامل يدور دوبلكس ول دار كبيرة تفرغ زينه 
للتواصل:38713233
الواتساب:،38713233",2 balcon(s) | Taille rue: 20.00 | Proche de: سانتير متير ,voursa.com,2025-05-17
1319,دار امع كدروه الداية 11,830000.0,180.0,4.0,2.0,,Arafat,دار امع كدروه الداية 11 الدخلاني فيه اربع ابيوع و جلسة و بوتيك و كوزين و دوشات شارع اكبير فكرن ,Titre foncier | 1 balcon(s) | Taille rue: 15.00 | Proche de: كدروه الداية 11 | Garage,voursa.com,2025-09-23
590,ديبلكس للبيع,11500000.0,375.0,9.0,3.0,3.0,Tevragh Zeina,"ديبلكس للبيع فرصة في سيكتير 5 فتفرغ زينة 
المساحة: 375 م 2 
منقوشة ومكروية ونظيفة ماشالله 
مبيوع ب 115 مليون",Garage,voursa.com,2026-01-19
838,دار فبريمير فوكها ستديو قرب مجمع الرحمة,850000.0,150.0,4.0,2.0,1.0,Teyarett,"ماه بعيد من مرصت سييدي وفاتح في برك بين كدروهات 
ملاحظة للراغبين في شراء أو إيجار او بيع دار أو نيمرو ماعليكم سوى التواصل معنا والله المستعان",,voursa.com,2025-12-20
1029,دار فكرفور احذ بقالة الله اكبر ,1500000.0,150.0,3.0,2.0,,Arafat,دار فكرفور احذ بقالة الله أكبر ,Titre foncier | 1 balcon(s) | Taille rue: 12.00 | Proche de: بقالة الله اكبر  | Garage,voursa.com,2025-11-06
477,سمعة في المشروع غرب گدروه كورونا,3400000.0,216.0,8.0,2.0,,Teyarett,منزل جيد فاتح اعل شارع اكبير,1 balcon(s) | Taille rue: 25.00 | Proche de: گدروه كورونا ,voursa.com,2025-04-20
1093,فرصة نيمر للبيع ف F nour  قرب سفارة الهند,5400000.0,600.0,0.0,0.0,0.0,Tevragh Zeina,فرصة نيمر للبيع قرب سفارة الهند الموقع جيد ممتاز,,voursa.com,2025-11-25
1240,ديبلكس  من اتراب bmci الي متوالي الصحراوي للبيع ,13500000.0,400.0,1.0,1.0,,Tevragh Zeina,السلام عليكم هذ ديبلكس من bmci متوالي الصحراوي نظيفه مشاء الله مبيوع ب مائة وخمس وثلاثين مليون قديمة للإستفسار اكثر اتصلوا على الرقم التالى 49546950,1 balcon(s) | Taille rue: 20.00 | Proche de: Bmci الصحراوي ,voursa.com,2025-06-30
668,150م٢ ف سكتير 1 من ابلوكات ,1100000.0,150.0,0.0,0.0,,Tevragh Zeina,"عندنا 150 فرصة بين البنيان في سكتير 1 بلوكات مبيوعه ب 11 ، فرصة نهاية الأسبوع 
للتواصل: 33906060.41380407",Titre foncier | Taille rue: N/A | Proche de: كتاب الضبط,voursa.com,2025-09-21
548,فيلا فالصحرواي اللبيع مبيوعه,54000000.0,200.0,3.0,1.0,,Tevragh Zeina,"فيلا فالصحرواي فاتح اعل شارع إكبير مساحته 200 مبيوعه ب 54مليون حد مهتم يتواصل معاي 27273277
حد عندو العقار اللبيع يتواصل معاي ",type de propriété: Villa | 1 balcon(s) | Taille rue: N/A | Proche de: فيلا فالصحرةاي ,voursa.com,2026-01-14
1326,ديبلكسين للبيع ,11000000.0,220.0,4.0,2.0,,Tevragh Zeina,"#للبيــــــــــــــــــــــع
فرصة إستثماريه 2 ديبلكس  فصحراوي  كريب 
من ستاصيوه ريم ريم 
دبلكسات نظيفات وبنياهم عصري. كلهم مساحته 220 
هاذ ديبلكسات أمبيع هوم ثنتين ب 110 
حد مهتم بيهم يتواصل معان 
#للتواصل

‏مراسلة  عبر واتساب. https://wa.me/22243414552",2 balcon(s) | Taille rue: 20.00 | Proche de: ستاصيوه ريم ,voursa.com,2025-04-24
462,فيلا جديدة أرضية للبيع في h3,3800000.0,216.0,4.0,2.0,,Teyarett,"فيلا أرضية للبيــــــــــــــــــــــع في h3 قرب مدرسة الجمهورية و كدروه السنوار 
فيه صالون و 3 بيوت وجلسة  و مرافق عمومية و كراج  فيه تهوية 
المساحة: 216 م² فاتح اعل بارك 
السعر : 38 مليون 
واتساب  22608090 فقط للجدين ",Titre foncier | 1 balcon(s) | Taille rue: 8.00 | Proche de: مدرسة الجمهورية  | Garage,voursa.com,2025-09-26
216,دار فدار النعيم شارع كبير,700000.0,216.0,4.0,1.0,2.0,Dar Naim,سعر 7 ملايين قابل لنقاش مكانه زين للاستثمار حد شاري ول عندو طلب تلفنل اعل واتساب وتوف [TÉLÉPHONE SUPPRIMÉ],,voursa.com,2026-02-13
686,دار لاحكة المقطة على شارع كبير ف ترحيل حياة جديدة,340000.0,120.0,4.0,4.0,2.0,Arafat,دار لاحكة المقطة على شارع كبير ف ترحيل حياة جديدة,Garage,voursa.com,2026-01-08
1258,ثلاث باتيك على كدروه للبيـــــــــــــــــــــع  الفلوجة ,1800000.0,150.0,1.0,1.0,,Arafat,"السلام عليكم
3 باتيك للبيع فاتحين على كدروه الفلوجه
دخل 90 الف
المساحة 150م٢ 
السعر 18مليون",Titre foncier | 1 balcon(s) | Taille rue: 40.00 | Proche de: كرفو سنابي,voursa.com,2025-05-17
885,سمعه للبيع لكصر فاتح على بارك وفكرن ,5500000.0,300.0,6.0,2.0,,Teyarett,"السلام عليكم 
سمعه نظيفه لكصر من الفوق 
  للبيـــــــــــــــــــــع 
معاه لفراش 
فاتح على بارك وفكرن 
المساحة 300م٢ 
لاوراق تيتر فونسي 
السعر 52 مليون ",Titre foncier | 1 balcon(s) | Taille rue: 20.00 | Proche de: بقالة الصين | Garage,voursa.com,2025-05-05
1177,دار فلوج فاتح T,1200000.0,150.0,3.0,2.0,,Arafat,سعر 12 مليون حد شاري ول عندو شي ابيعو تلفنل 26678975.36147216,1 balcon(s) | Taille rue: 8.00 | Proche de: فلوج,voursa.com,2025-11-12
634,دار فسند شارع كبير,7000000.0,600.0,7.0,2.0,,Tevragh Zeina,سعر 70 مليون حد شاري ول عندو شي ابيعو تلفنل 26678975.36147216,Titre foncier | 1 balcon(s) | Taille rue: 25.00 | Proche de: كرفور اسند ,voursa.com,2025-11-19
869,دار فعرفات اللكات,1700000.0,150.0,3.0,2.0,,Arafat,دار فعرفات اللنكات,Titre foncier | 1 balcon(s) | Taille rue: 15.00 | Proche de: اللنكات | Garage,voursa.com,2025-10-16
835,سمع لبيع في تفرغ زينه سكتر5 قرب اطل,5600000.0,300.0,7.0,3.0,,Tevragh Zeina,هاذي السمع زينه حته وفيه فرصة اليوم لاتفتكم يا اهل تفرغ زينه,Titre foncier | 3 balcon(s) | Taille rue: 20.00 | Proche de: البياه | Garage | Meublé | Caméra de sécurité,voursa.com,2025-12-04
292,دار فعرفات الداية 19,1500000.0,150.0,3.0,2.0,,Arafat,دار زينه فعرفات الداية 19 بينه هي و الداية 18 بينه نيمروين مع كدروه ارض الجنتين,Titre foncier | 1 balcon(s) | Taille rue: 10.00 | Proche de: الداية 19 | Garage,voursa.com,2025-10-12
