id,titre,prix,surface_m2,nb_chambres,nb_salons,nb_sdb,quartier,description,caracteristiques,source,date_publication
98,للبيع منزل من الطراز الأول بالقرب من أتاك الخير  ,16000000.0,600.0,9.0,5.0,,Tevragh Zeina,"للبيع منزل من الطراز الأول بالقرب من أتاك الخير مساحة 600 م السعر 160 رقم الهاتف,واتساب : 32050518",Titre foncier | 3 balcon(s) | Taille rue: 20.00 | Proche de: أتاك الخير | Garage,voursa.com,2025-07-17
1338,دار للبيع في تفرغ زينه قرب صلطنت عومان,6500000.0,300.0,6.0,2.0,4.0,Tevragh Zeina,هاذي الدر قرب كرفور المحلب  وقرب  اتراب الصحراوي,Caméra de sécurité | Meublé | Garage,voursa.com,2025-10-23
1409,شانتية للبيع في اغنودرت ,1200000.0,300.0,3.0,2.0,,Tevragh Zeina,"نمرو للبيــــــــــــــــــــــع في اغنودرت فيه شانتية  
المساحة: 300 م²
السعر : 12 مليون ",1 balcon(s) | Taille rue: 10.00 | Proche de: كدروه انواذيبو  | Garage,voursa.com,2025-07-24
1271,ديبلكس في اتو فاتح ف ابرك للبيع ,6500000.0,700.0,7.0,2.0,,Tevragh Zeina,السلام عليكم هذ ديبلكس ف اتو مساحتها 700م# فاتح ف ابرك مبيوع ب 65مليون للإستفسار اكثر اتصلوا على الرقم التالي 49546950,Titre foncier | type de propriété: Duplex | 2 balcon(s) | Taille rue: 20.00 | Proche de: ديبلكس,voursa.com,2026-02-25
1066,ديبلكس فصحراوي,5600000.0,200.0,7.0,1.0,2.0,Tevragh Zeina,"ديبلكس في الصحراوي  بالقرب من منزل مسقارو 
مساحة 200م٢
سعر 56مليون حد شاري تلفنل [TÉLÉPHONE SUPPRIMÉ].[TÉLÉPHONE SUPPRIMÉ]",,voursa.com,2025-11-28
678,دار فعرفات كدروه الداية 11 الدخلاني ,900000.0,150.0,3.0,2.0,,Arafat,دار فعرفات كدروه الداية 11 الدخلاني مبنية 2019 ,Titre foncier | 1 balcon(s) | Taille rue: 8.00 | Proche de: الداية 11  | Garage,voursa.com,2025-11-05
134,ديبلكس فصحراوي ,11000000.0,400.0,1.0,1.0,,Tevragh Zeina,سعر 110ملايين حد شاري تلفنل اعل واتساب 26678975,Titre foncier | type de propriété: Duplex | 1 balcon(s) | Taille rue: 25.00 | Proche de: الصحراوي,voursa.com,2025-12-23
966,ديبليكس ,6500000.0,200.0,6.0,3.0,,Teyarett,ديبليكس الجديد و النظيفة ما شاء الله فرصة الرجاء التواصل معنا على الرقم 27281870 لاتصال و الواتساب,Titre foncier | 1 balcon(s) | Taille rue: N/A | Proche de: كدروه البوادي | Garage,voursa.com,2025-07-13
807,سمعه كبيره واجديد فعرفات ,3000000.0,180.0,3.0,2.0,,Arafat,"واتساب 26678975 للاتصال 36147216
فعرفات كد تكوين العلماء سعر 30مليون
قابل لنقاش وشارع كبير حت دخله 200الف",2 balcon(s) | Taille rue: 30.00 | Proche de: مركز تكوين العلماء ,voursa.com,2025-04-11
848,عقار في حي الفلوجة ,1500000.0,150.0,3.0,2.0,,Arafat,"عقار جيد للسكن و للإستثمار  بنيان قوي جديد والموقع إستراتيجي فاتح أعل كدروه فرصة لاتفوتك للإستفسار الرقم 47628272 واتساب 
",Titre foncier | 1 balcon(s) | Taille rue: 18.00 | Proche de: سوق الياقوت  | Garage,voursa.com,2025-11-12
454,دار ف دار السلامه,700000.0,150.0,3.0,2.0,,Dar Naim,دار ف دار السلامه  فاتحه فالبرك و منقوشه و مكرويه فاركين بيها مبديتين و فيها صلوه و بيت ركاد و بيت جماعه و كوزين و دوش بيبليك فيها هول و بوتيك و تهويه الكدام مكريه ب 35 ألف و البوتيك مكري ب 15 ألف ,1 balcon(s) | Taille rue: 25.00 | Proche de: دار السلامه,voursa.com,2025-04-23
1059,دار للبيــــــــــــــــــــــع ,2200000.0,250.0,4.0,2.0,,Toujounine,دار للبيـــــــــــــــــــع في الفلوجة فاتح اعل شارع إكبير فيه اثلت ابيوت وجلسه منقوش امكروي ,Titre foncier | 1 balcon(s) | Taille rue: 50.00 | Proche de: الفلوجه  | Garage,voursa.com,2025-04-25
1156,سوق للبيع عند بوتيك كسكس,35000000.0,1000.0,,2.0,,Tevragh Zeina,"سوق يتألف من 45 بوتيك 
المساحة 1000 متر  مربع 
الدخل 2 مليون و300 ألف
السعر 350 مليون 
تيتر فونسيي
حذا بوتيك كسكس
واتساب 26678975 للاتصال 36147216
 ",1 balcon(s) | Taille rue: 30.00 | Proche de: بوتيك كسكس,voursa.com,2025-04-15
153,دار فعين الطلح فرصة ,2100000.0,150.0,3.0,1.0,,Teyarett,"دار فعين الطلح كريب من كدروه حذي بقالة العافية 2 فيها 3بيوت وجلسة وكوزين وحمامات منقوشة ومكروية
السعر :21مليون قابلة للتفاوض 
الواتساب :44866293",type de propriété: Villa | Taille rue: 8.00 | Proche de: عين الطلح بقالة العافية  2 | Caméra de sécurité,voursa.com,2026-02-11
112,منزل للبيع في دار السلامه,500000.0,180.0,3.0,2.0,2.0,Teyarett,"السلام عليكم 
منزل للبيع في دار السلام قرب مؤسسة مولو بينو مع كدروه نيمرو واحد 

فيه ثلاث غرف و هول منقوش ومكروي",Meublé | Garage,voursa.com,2026-02-21
617,فيلا ارضيه,3600000.0,216.0,3.0,2.0,,Tevragh Zeina,"#للبيع  
فيلا أرضية للبيع جديدة يقع  في منطقةصكوك . 
 بالقرب بقالة شباب 

تتكون :
صالوه + جلسة  + غرفة متوسطة. + غرفة نوم 🛌 بحمامها. + حمام عمومي. + مطبخ. فناء خارجي. + كراج 
#السعر :36مليون  
#للتواصل: ‏عبر واتساب. https://wa.me/22243414552",1 balcon(s) | Taille rue: 15.00 | Proche de: صكوك,voursa.com,2025-04-08
978,سمع للبيع في تفرغ زينه قرب الجامع لبنانيي,5600000.0,300.0,8.0,5.0,,Tevragh Zeina,هاذي السمع زبنه حته وفبه فرصة اليوم  قرب الجامع لببنانييه,Titre foncier | 3 balcon(s) | Taille rue: 20.00 | Proche de: البياه | Meublé,voursa.com,2025-10-05
798,فرصة قطعة ارضي ف الحي الجامعي خلف حمام نيل فاتح عل كدروه وفاتح عل شارعين اخرين,15000000.0,1105.0,0.0,0.0,,Tevragh Zeina,فرصة نيمر للبيع ف الحي الجامعي فاتح 3 فتحات وحد منهم عل كدروه مناسب جدا للأستثمار ,Titre foncier | Taille rue: 30.00 | Proche de: حمام نيل,voursa.com,2025-11-17
1184,دار فكرفور اعل شارع اكبير,1400000.0,180.0,5.0,1.0,2.0,Arafat,دار فكرفور احذ كراج الدولة منقوشة و مكروية وتكفاله زين,Garage,voursa.com,2025-11-14
890,دار اكبيره و زينه,1150000.0,197.0,5.0,1.0,1.0,Arafat,دار فتن سويلم منطقة فراج الديك اكبيره مكفوله اعل 3 ابيوت و صالوه و جلستين و الكدام فيه تحويشه فيها بيت للعامل و كوزين و دوش و لمطاليع و تحويشتها مكرويه كامله و بنيانها زين و مظبوط فتبارك الله و اتواقطها تامين السعر 11.500.000 حد مهتم يطلعنا اعل واتساب [TÉLÉPHONE SUPPRIMÉ],,voursa.com,2025-12-16
465,ديبلكس نظيف ف صانتر متير للبيع,5000000.0,300.0,5.0,3.0,,Tevragh Zeina,"#فرصة_
#ديبلكس للبيع  في منطقة تفرغ زين سانتر متير ( موديل K ) بالقرب من وزارة الخارجية فكرن سعر 50 مليون قابل لنقاش 

يتكون من طابقين : الطابق الأرضى يتكون من صالون  + صالة + مرآب + مطبخ + حمام عمومي + غرفة عامل مع حمام
 
الطابق العلوي : يتكون من غرفة نوم مع حمام عمومي  + غرفتين + بلكوه
الشارع : 15 م
للاتصال : 36897338
الواتساب : 36897338",Titre foncier | 1 balcon(s) | Taille rue: 15.00 | Proche de: وزارة الخارجية  | Garage,voursa.com,2025-07-01
48,فرصة دار للبيع فكارفور أم قصر ,950000.0,150.0,3.0,2.0,,Arafat,فرصة عقار سكين للبيع بالقرب من كارفور أم قصر يتألف من 3 غرف وجلسة وأگراج الثمن 9مليون و500 ألف قديمة,1 balcon(s) | Taille rue: 6.00 | Proche de: عقار سكني,voursa.com,2025-04-05
111,فرصة منزل للبيع قرب وقفة صكوك,2000000.0,216.0,5.0,4.0,3.0,Teyarett,فرصة منزل للبيع قرب وقفة صكوك فيه 3 بيوت وصالون وكاراج فاتح على ساحة عمومية  وقريب من كدروه,Garage,voursa.com,2026-02-22
1354,عندن ذاك دار للبيـــــــــــــــــــــع في المطار القديم إبلوك 9,3500000.0,200.0,3.0,2.0,,Dar Naim,"دار للبيـــــــــــــــــــــع جديدة 
في المطار القديم  إبلوك 09
فاتح اعل جهت للبحر 
فاتح على شارع 12
فيها ثلاث بيوت جلسة كوزين ودوشات اكراج تهوية منقوشة مكروية 
المساحة:200 م² 
*السعر 35 مليون قابل للتفاوض* حد مهتم يتواصل معاي واتساب 27273277",1 balcon(s) | Taille rue: 12.00 | Proche de: دار للبيـــــــــــــــــــــع أفي المطار القديم إبلوك 9,voursa.com,2025-09-05
1273,دار في المطار,3000000.0,200.0,4.0,2.0,,Dar Naim,"دار فالمطار القديم مافات ندخلت
المساحة : 200م²
الاوراق: تيتر فونصي 
فيها 4 غرف وجلسة وحمامات ومطبخ وتهوية وكراج 
الشارع : 12م
السعر : 30 مليون 
الاتصال : 38138366
الواتساب : 46440020",Taille rue: 12.00 | Proche de: مدينة المرح | Garage,voursa.com,2025-07-18
283,دار للبيع,1200000.0,216.0,6.0,3.0,,Dar Naim,"السلام عليكم 
عندنا ذيك دار للبيع اف تنسويلم 
قرب مسجد أهل احمد يوره
فاتح اعل شارع 8م²
المساحه 216م٢
السعر 12 مليون ونصف",Titre foncier | 1 balcon(s) | Taille rue: 8.00 | Proche de: مسجد أهل أحمد يورة | Caméra de sécurité | Meublé,voursa.com,2025-12-02
713,دار فالفلوجة,1400000.0,150.0,3.0,1.0,2.0,Arafat,دار فالفلوجة,Garage,voursa.com,2026-01-05
626,منزل للبيـــــــــــــــــــــع ملح سكتير 1,1400000.0,180.0,3.0,1.0,2.0,Toujounine,"السلام عليكم 
دار مظبوطة للبيـــــــــــــــــــــع ملح سكتير 2
فاتح على شارع كبيره 
فيه ثلاث بيوت جلسة كوزين ودوشات مكزينه اكراج منقوشة مكروية المساحة180م٢ 
السعر 14 مليون",Garage,voursa.com,2026-01-14
1200,سمعه فدار النعيم الزر ال متوالي اطريق عزيز,1500000.0,180.0,7.0,3.0,,Dar Naim,سمعه اجديده فدار النعيم الزر ال متوالي طريق عزيز,Titre foncier | 1 balcon(s) | Taille rue: 10.00 | Proche de: طريق عزبز | Garage,voursa.com,2025-10-15
782,دار اللبيع ف الفوز,4000000.0,200.0,3.0,2.0,,Teyarett,عندن دار اللبيع ف الفوز مبيوع ب 40 حد مهتم يتواصل معاي حد مهتم يتواصل معاي واتساب 27273277  ,1 balcon(s) | Taille rue: 15.00 | Proche de: الفوز,voursa.com,2025-07-02
91,فيلا رضي للبيع في  تفرغ زينه إلوسي قرب القصر الرءاس,5500000.0,300.0,6.0,3.0,3.0,Tevragh Zeina,هاذي الدر زينه حته وفيه فرصة اليوم يا اهل تفرغ زينه هاذي  فرصه ذهبيه,Caméra de sécurité | Meublé | Garage,voursa.com,2026-02-23
228,دار اعلي شارع اكبير ف الفلوجة للبيع ,1350000.0,180.0,4.0,2.0,,Toujounine,السلام عليكم هذ دار ف الفلوجة اعلي شارع اكبير مساحة 180م# فيها اربع ابيوت وجلسه مبيوع ب 13مليون واخمس مائة للإستفسار اكثر اتصلوا على الرقم التالي 49546950,1 balcon(s) | Taille rue: 20.00 | Proche de: الفلوجة ,voursa.com,2025-07-26
746,منزل للبيع ,5500000.0,300.0,5.0,3.0,,Ksar,"منزل للبيع فلكصر
فالكَرن  
الطابق العلوي مستقل عندو مدخل مع الباب الرسمي ومدخل مع الشارع الثاني",Titre foncier | Taille rue: N/A | Proche de: مقابل لمدرسة بلال الولي سابقاً ,voursa.com,2025-10-07
436,فيلا للبيع,35000000.0,1200.0,5.0,5.0,4.0,Tevragh Zeina,"🏡 فيلا فخمة للبيع أو للإيجار
📍 موقع ممتاز داخل المدينة
✨ تشطيب راقي ومساحة واسعة
🛏️ غرف متعددة + صالونات كبيرة
🌿 حوش واسع وتهوية ممتازة
مناسبة للعائلات أو الشركات أو السفارات
⚠️ للجادين فقط – التفاصيل بعد المعاينة

[TÉLÉPHONE SUPPRIMÉ]",,voursa.com,2026-01-29
467,ابرتمهات ومكزينه ف iloca,6500000.0,300.0,6.0,1.0,2.0,Tevragh Zeina,"سعر 65 مليون دخلهم شهري 440الف 
حد شاري ول عندو طلب تلفنل اعل واتساب فقط [TÉLÉPHONE SUPPRIMÉ]",,voursa.com,2026-01-27
442,فرصة ديبلكس للبيع ف سكتير 5 موقع جيد ,9500000.0,250.0,5.0,1.0,,Tevragh Zeina,فرصة ديبلكس للبيع اجديد ف سكتير 5 موقع جيد  اجديد مكط اسكن ,Titre foncier | type de propriété: Duplex | 1 balcon(s) | Taille rue: 20.00 | Proche de: سكتير 5 | Garage,voursa.com,2026-01-19
209,دار فالمشروع للبيع احذا وقفة صوكوك واجيال,1800000.0,216.0,3.0,2.0,,Teyarett,دار زينه مظبوطه هيه احذا مدرسة أجيال واحذا وقفة صوكوك امل احذا اطليان اكريبه منهم دار فيها اثلت ابيوت او هول او كوزين وادوشات مكرويه او منقوشه هيه او فيها بتيك اصغير او تحويشه ماهي اكبيره او كدامها منشر محوش اعليه ابكرياج وابمدخلها امل دار زينه مظبوطه فرصه تنباع ب 18 مليون فاتحه افشارع عشره ولا ذاك وهناك خيارات اخري كثيره ومتنوعه اديار وابرتماهات واسمع واستديوهات واباتيك او نيمروات ينباع امل من وكالة السماحة العقارية احمد بمب الارقام 22810713 /33810713 شنكيتل اعليه وادساب نحن دائما في خدمتكم ونوفر لكم كل ماهو جديد ومتجدد وحسن ومتميز ونرحب بالجميع ,2 balcon(s) | Taille rue: 10.00 | Proche de: مدرسة أجيال ووقفت صوكوك ,voursa.com,2025-04-26
1033,فعين طلح فكرن ,1800000.0,150.0,4.0,2.0,,Teyarett,"دار زين وتواغطه برم وكيتانس سعر 18مليون قابل للنقاش واتساب 26678975للاتصال 36147216
مساحه 12*12",1 balcon(s) | Taille rue: 10.00 | Proche de: بقاله الرحمه,voursa.com,2025-05-19
1008,سمعه زين فكرفور فاتح فبرك,1800000.0,180.0,4.0,2.0,,Arafat,واتساب 26678975 للاتصال 36147216  السعر 18مليون قابل للنقاش ,1 balcon(s) | Taille rue: 20.00 | Proche de: سوق مكه,voursa.com,2025-05-14
393,دارين للبيع برمير بكين ,3500000.0,432.0,6.0,2.0,,Teyarett,"السلام عليكم 
دارين للبيـــــــــــــــــــــع برمير بكين 
كلهم فاتح على شارع 8 
كريب من كدروه 
كلهم فيها اربع بيوت تهوية 
وحد فوقها بيوت من السنك 
كلهم المساحة 216م٢ 
المساحة الجمالية 432
السعر 35 مليون ",Titre foncier | 2 balcon(s) | Taille rue: 8.00 | Proche de: بكين ,voursa.com,2025-04-24
93,ديبلكس. للبيع ,8000000.0,200.0,7.0,2.0,,Tevragh Zeina,ديبلكس برمير أشوا. جديد بالقرب من دامبور 📍,Titre foncier | type de propriété: Duplex | 1 balcon(s) | Taille rue: 15.00 | Proche de: كرفور دامبور  | Garage,voursa.com,2025-12-11
692,منزل في ابريمي قرب بقالة فرنساء,6500000.0,180.0,9.0,7.0,,Teyarett,"منزل في ابريمي قرب بقالة فرنساء
على كدروه قريب من ملتقى طريق بقالة الشباب و بقالة فرنساء.
يتكون من :
1- طابق ارضي : كراج و محل و غرفتين نوم و صالون و جلسة صغيرة و مطبخ صغير و مرحاض عمومي.
ملاحظة هاذا الطابق مستقل.
2- الطابق الاول : غرفتين نوم و صالون كبير و غرفتين و مرحاض عمومي.
3- الطابق الثاني: غرفة و مطبخ و  مرحاض عمومي.
الاوراق تيتر فوسي.
السعر = 65.000.000 MRO",Titre foncier | 1 balcon(s) | Taille rue: 20.00 | Proche de: بقالة فرنساء. | Garage,voursa.com,2025-04-10
556,دار فابوحديده,1050000.0,120.0,3.0,1.0,2.0,Toujounine,دار افبوحدبده بين كدروهات,Garage,voursa.com,2026-01-21
992,ديبلكس ف H8 بينها نيمرو واحد مع كدروه كورونا,3500000.0,216.0,3.0,3.0,,Teyarett,فرصة ديبلكس ف H8 بينها نيمرو واحد مع كدروه كورونا فاتح فبرك وفكرن مبيوع ب 35 ,Titre foncier | 1 balcon(s) | Taille rue: 20.00 | Proche de: كدروه كورونا  | Garage,voursa.com,2025-04-02
1438,دار فعين الطلح,2200000.0,150.0,3.0,1.0,2.0,Teyarett,دار اجديده مافات اندخلت فعين الطلح كد كدروه الطينطان,Garage,voursa.com,2026-03-01
1095,دبلكس درجه أولاً للبيع,5800000.0,225.0,7.0,5.0,,Teyarett,دبلكس درجة اولا افكرن شارع اكبير وشارع 10 مساحته زايدة عل 216 فيه كراج يرفد وتين وبيت عامل ودوشو وتهويه وفيه من تحت صالونه كبير 10 وجلستين كبرات وفيه من الفوك بيتين اركاد كبار وحد فيه بلكرات وبلكوهين وبيت اوخر وجلسه وكزين أوروبي ,Titre foncier | 2 balcon(s) | Taille rue: 25.00 | Proche de: شهرزاد  | Garage,voursa.com,2025-11-07
69,دار فعين طلح,1500000.0,150.0,4.0,1.0,,Teyarett,سعر 15مليون حد شاري تلفنل 26678975.36147216,Titre foncier | 1 balcon(s) | Taille rue: 8.00 | Proche de: كنكري ساحل,voursa.com,2025-10-03
1406,سمعه 3 طوابق بين الفلوجة.وداي 19 للبيع ,2900000.0,150.0,1.0,1.0,,Arafat,السبام عليكم هذ سمعه تتكون من 3 طوابق بين الفلوجة  وداي 19 ادخل مائة وثمانين الف قديمة مساحتها 150م# مبيوع ب 29مليون للإستفسار اكثر اتصلوا على الرقم التالي 49546950,1 balcon(s) | Taille rue: 15.00 | Proche de: الفلوجة ,voursa.com,2025-06-15
862,Villa de luxe ,8500000.0,990.0,6.0,5.0,,Teyarett,منزل فاخر يتكون من مساحة 990 متر مربع، صالون 14 متر ، صالتين ، غرفة ، أربعة غرف نوم مع حمامات ، حمام عمومي ،مطبخ أروبي كبير، أستوديو خارجي   مكتمل و مرافق خارجية للعمال مع مطبخ حديقة كبيرة جدا و2 گراج يتسعان لأكثر من ستة سيارات ,3 balcon(s) | Taille rue: N/A | Proche de: بقالة جيني 2,voursa.com,2025-07-15
488,Maison à vendre ,1800000.0,150.0,7.0,4.0,,Arafat,"Maison étage à vendre, En bas 3 chambres une avec salle de bain,salon,sejour,toilette publique,cuisine et une boutique. A l etage 2chambres avec salle de bain,salon,sejour,salle a manger,cuisine ,balcon et une petite magazin",1 balcon(s) | Taille rue: 10.00 | Proche de: Carafour nsidou nour | Garage | balcon | chambre | salon | toilette,voursa.com,2025-05-01
194,دار فعرفات الداية 18,800000.0,150.0,3.0,2.0,,Arafat,دار فعرفات الداية 18 اجديده ماله ش مبنيه,Titre foncier | 1 balcon(s) | Taille rue: 15.00 | Proche de: الداية 18 | Garage,voursa.com,2025-11-14
190,Maison 700 m2,7000000.0,700.0,8.0,4.0,,Tevragh Zeina,A cote gudron ewkar,2 balcon(s) | Taille rue: 30.00 | Proche de: Awkar,voursa.com,2025-04-28
1391,دار سكن للبيع,1750000.0,300.0,4.0,4.0,,Teyarett,"السلام عليكم: عندنه دار سكن اكبيرة للبيع ف تيارت بالقرب من ملعب و طب تيارت ، تتكون من منزل اكبير في الدور الأرضي و ابرتماه فوگ مستقل مبنين ف تراب من نمروين مجموع مساحتهم 300م بسند عقاري تيتر فونسى لكل نيمرو. 
اترابه باگي منه ال يبني دار و ل ابرتماه مستقل .",Titre foncier | 1 balcon(s) | Taille rue: N/A | Proche de: مستوصف تيارت | Garage,voursa.com,2025-08-03
226,سمعه احذ جسر الحي الساكن,850000.0,150.0,7.0,2.0,2.0,Dar Naim,سمعه اكريب من جسر الحي الساكن امدخله 70الف للشهر,Garage,voursa.com,2026-02-14
892,منزل في الاتحادية قرب محطات النقل,550000.0,120.0,4.0,2.0,1.0,Teyarett,"السلام عليكم 
عندي منزل في الاتحادية فيه دار مكفوله من السنك فيه بتيك يشتقل . موقع ممتاز في كرن شوارع كبار جانب طريق اكجوجت . إيجارها 50 ألف تقديرا",Garage | Caméra de sécurité | Meublé,voursa.com,2025-12-17
927,دوبلكس للبيع لم يسكن بعد ,10000000.0,200.0,5.0,4.0,,Tevragh Zeina,دوبلكس للبيع لم يسكن من قبل جديد المساحة 200م مجهز بالكامل من الداخل والخارج بأحدث صيحات البناء وفي مكان راقي من تفرق زين الصحراوي للإطلاع اكثر تواصل معنا 36707610. اللهم صلي وسلم وبارك على سيدنا محمد وعلى اله وصحبه اجمعين ,2 balcon(s) | Taille rue: 20.00 | Proche de: منزل الوزير الأول ول أنحاي ,voursa.com,2025-04-22
1094,الفلوجة,2100000.0,120.0,3.0,2.0,,Toujounine,"للتواصل :41366086 
دار منقوشة  و مكروية للبيـــــــــــــــــــــع الفلوجة 
فاتح على شارع كبيره فكرن شارع كبيره 
فيه :ثلاث بيوت و جلسة و كوزين و دوشات 
",1 balcon(s) | Taille rue: 25.00 | Proche de: الفلوجة,voursa.com,2025-04-20
517,دار للبيع,850000.0,180.0,4.0,4.0,1.0,Arafat,"دار فملح سكتير 2 فاتح اعل شارع اكبير فيه كراج برفد وت اكبيره 4 ابيوت ادوشين واكويزين فرصة ب 8 ملايين و 500
للاتصال الرقم [TÉLÉPHONE SUPPRIMÉ]
[TÉLÉPHONE SUPPRIMÉ]",Garage,voursa.com,2026-01-24
461,ابرتمهات بدخلهم اوفو كيل,1300000.0,150.0,4.0,2.0,2.0,Arafat,"سعر 13 مليون دخلهم 120الف حد شاري ول عندو طلب تلفنل اعل واتساب وتوف 
[TÉLÉPHONE SUPPRIMÉ]",,voursa.com,2026-01-29
975,ديبلكس ابريمير اشوى فسكتير واحد اف نور  تفرغ زينة اجديدة مافات اندخلت ,6200000.0,200.0,9.0,4.0,,Tevragh Zeina,41665530,1 balcon(s) | Taille rue: 15.00 | Proche de: كرفور جامبور ,voursa.com,2025-04-27
7,عندنا دار للبيـــــــــــــــــــــع اف المطار القديم,3800000.0,216.0,3.0,1.0,2.0,Dar Naim,"سلام عليكم 
دار للبيع في المطار القديم إبلوك 24 مساحتها 216 
فاتحه على شارع 10  رقم نيمروها 33 
وبينها نيمرو واحد مع كدروه الجاي 
من عند كرفور بلال ب 38 مليون حد مهتم يتواصل معاي واتساب [TÉLÉPHONE SUPPRIMÉ]",,voursa.com,2025-08-19
75,دار فبيك 7 فاتح فبرك,700000.0,180.0,4.0,1.0,1.0,Riyadh,سعر 7 ملايين حد شاري ول عندو طلب تلفنل اعل واتساب وتوف [TÉLÉPHONE SUPPRIMÉ],,voursa.com,2026-02-24
1203,شانتي ديبلكس بالقرب من طب القلب للبيع ,3000000.0,150.0,1.0,2.0,,Tevragh Zeina,السلاام عليكم هذ شانتي ديبلكس فات اوغطات مسنوريها حكمن وافي كامل مساحتها 150م# بالقرب من طب القلب مبيوع ب 30مليون للإستفسار اكثر اتصلوا على الرقم التالى 49546950,1 balcon(s) | Taille rue: 15.00 | Proche de: طب القلب ,voursa.com,2025-06-02
